{
  "registry_family": "resolution_states",
  "registry_census": {
    "registry_family": "resolution_states",
    "count": 10,
    "scope_stratum": "ENGINE_ENUM_CONSISTENCY",
    "admitted": 10,
    "embedded_nonowner": 0,
    "dormant_nonselectable": 0,
    "stale_remove": 0
  },
  "family_policy": {
    "scope_stratum": "ENGINE_ENUM_CONSISTENCY",
    "admission_disposition": "ACTIVE_ADMITTED",
    "admission_evidence": "ACCEPTED_ENGINE_VOCABULARY_PLUS_CROSS_SURFACE_CONSISTENCY",
    "semantic_owner": "DEV/docs/superpowers/specs/2026-08-19-step-3-execution-boundary-canonical-spec.md",
    "machine_destination_family": "DEV/CATALOG/core-catalog.json#/registries/resolution_states",
    "consumer_or_dependency": "owning catalog/schema/runtime contract",
    "identity_namespace_owner": "N/A Р Р†Р вЂљРІР‚Сњ closed engine vocabulary or non-package identity",
    "default_realization_state": "COMPLETE",
    "default_downstream_owner": null,
    "notes": "Admission and registry-level realization are complete for S6D-02."
  },
  "entries": [
    {
      "registry_family": "resolution_states",
      "id": "PENDING",
      "profile": "resolution_states",
      "scope_stratum": "ENGINE_ENUM_CONSISTENCY",
      "realization_state": "COMPLETE",
      "downstream_owner": null,
      "semantic_owner": "DEV/docs/superpowers/specs/2026-08-19-step-3-execution-boundary-canonical-spec.md",
      "admission_disposition": "ACTIVE_ADMITTED",
      "evidence_class": "ACCEPTED_ENUM_CONSISTENCY",
      "evidence_citation": "DEV/docs/superpowers/specs/2026-08-19-step-3-execution-boundary-canonical-spec.md; exact closed enum member: PENDING",
      "consumer_or_dependency": "owning catalog/schema/runtime contract; exact ID: PENDING"
    },
    {
      "registry_family": "resolution_states",
      "id": "RUNNING",
      "profile": "resolution_states",
      "scope_stratum": "ENGINE_ENUM_CONSISTENCY",
      "realization_state": "COMPLETE",
      "downstream_owner": null,
      "semantic_owner": "DEV/docs/superpowers/specs/2026-08-19-step-3-execution-boundary-canonical-spec.md",
      "admission_disposition": "ACTIVE_ADMITTED",
      "evidence_class": "ACCEPTED_ENUM_CONSISTENCY",
      "evidence_citation": "DEV/docs/superpowers/specs/2026-08-19-step-3-execution-boundary-canonical-spec.md; exact closed enum member: RUNNING",
      "consumer_or_dependency": "owning catalog/schema/runtime contract; exact ID: RUNNING"
    },
    {
      "registry_family": "resolution_states",
      "id": "AWAITING_CHOICE",
      "profile": "resolution_states",
      "scope_stratum": "ENGINE_ENUM_CONSISTENCY",
      "realization_state": "COMPLETE",
      "downstream_owner": null,
      "semantic_owner": "DEV/docs/superpowers/specs/2026-08-19-step-3-execution-boundary-canonical-spec.md",
      "admission_disposition": "ACTIVE_ADMITTED",
      "evidence_class": "ACCEPTED_ENUM_CONSISTENCY",
      "evidence_citation": "DEV/docs/superpowers/specs/2026-08-19-step-3-execution-boundary-canonical-spec.md; exact closed enum member: AWAITING_CHOICE",
      "consumer_or_dependency": "owning catalog/schema/runtime contract; exact ID: AWAITING_CHOICE"
    },
    {
      "registry_family": "resolution_states",
      "id": "AWAITING_REACTION",
      "profile": "resolution_states",
      "scope_stratum": "ENGINE_ENUM_CONSISTENCY",
      "realization_state": "COMPLETE",
      "downstream_owner": null,
      "semantic_owner": "DEV/docs/superpowers/specs/2026-08-19-step-3-execution-boundary-canonical-spec.md",
      "admission_disposition": "ACTIVE_ADMITTED",
      "evidence_class": "ACCEPTED_ENUM_CONSISTENCY",
      "evidence_citation": "DEV/docs/superpowers/specs/2026-08-19-step-3-execution-boundary-canonical-spec.md; exact closed enum member: AWAITING_REACTION",
      "consumer_or_dependency": "owning catalog/schema/runtime contract; exact ID: AWAITING_REACTION"
    },
    {
      "registry_family": "resolution_states",
      "id": "HYDRATION_REQUIRED",
      "profile": "resolution_states",
      "scope_stratum": "ENGINE_ENUM_CONSISTENCY",
      "realization_state": "COMPLETE",
      "downstream_owner": null,
      "semantic_owner": "DEV/docs/superpowers/specs/2026-08-19-step-3-execution-boundary-canonical-spec.md",
      "admission_disposition": "ACTIVE_ADMITTED",
      "evidence_class": "ACCEPTED_ENUM_CONSISTENCY",
      "evidence_citation": "DEV/docs/superpowers/specs/2026-08-19-step-3-execution-boundary-canonical-spec.md; exact closed enum member: HYDRATION_REQUIRED",
      "consumer_or_dependency": "owning catalog/schema/runtime contract; exact ID: HYDRATION_REQUIRED"
    },
    {
      "registry_family": "resolution_states",
      "id": "PUBLISH_REQUIRED",
      "profile": "resolution_states",
      "scope_stratum": "ENGINE_ENUM_CONSISTENCY",
      "realization_state": "COMPLETE",
      "downstream_owner": null,
      "semantic_owner": "DEV/docs/superpowers/specs/2026-08-19-step-3-execution-boundary-canonical-spec.md",
      "admission_disposition": "ACTIVE_ADMITTED",
      "evidence_class": "ACCEPTED_ENUM_CONSISTENCY",
      "evidence_citation": "DEV/docs/superpowers/specs/2026-08-19-step-3-execution-boundary-canonical-spec.md; exact closed enum member: PUBLISH_REQUIRED",
      "consumer_or_dependency": "owning catalog/schema/runtime contract; exact ID: PUBLISH_REQUIRED"
    },
    {
      "registry_family": "resolution_states",
      "id": "COMPLETED",
      "profile": "resolution_states",
      "scope_stratum": "ENGINE_ENUM_CONSISTENCY",
      "realization_state": "COMPLETE",
      "downstream_owner": null,
      "semantic_owner": "DEV/docs/superpowers/specs/2026-08-19-step-3-execution-boundary-canonical-spec.md",
      "admission_disposition": "ACTIVE_ADMITTED",
      "evidence_class": "ACCEPTED_ENUM_CONSISTENCY",
      "evidence_citation": "DEV/docs/superpowers/specs/2026-08-19-step-3-execution-boundary-canonical-spec.md; exact closed enum member: COMPLETED",
      "consumer_or_dependency": "owning catalog/schema/runtime contract; exact ID: COMPLETED"
    },
    {
      "registry_family": "resolution_states",
      "id": "REJECTED",
      "profile": "resolution_states",
      "scope_stratum": "ENGINE_ENUM_CONSISTENCY",
      "realization_state": "COMPLETE",
      "downstream_owner": null,
      "semantic_owner": "DEV/docs/superpowers/specs/2026-08-19-step-3-execution-boundary-canonical-spec.md",
      "admission_disposition": "ACTIVE_ADMITTED",
      "evidence_class": "ACCEPTED_ENUM_CONSISTENCY",
      "evidence_citation": "DEV/docs/superpowers/specs/2026-08-19-step-3-execution-boundary-canonical-spec.md; exact closed enum member: REJECTED",
      "consumer_or_dependency": "owning catalog/schema/runtime contract; exact ID: REJECTED"
    },
    {
      "registry_family": "resolution_states",
      "id": "ABORTED",
      "profile": "resolution_states",
      "scope_stratum": "ENGINE_ENUM_CONSISTENCY",
      "realization_state": "COMPLETE",
      "downstream_owner": null,
      "semantic_owner": "DEV/docs/superpowers/specs/2026-08-19-step-3-execution-boundary-canonical-spec.md",
      "admission_disposition": "ACTIVE_ADMITTED",
      "evidence_class": "ACCEPTED_ENUM_CONSISTENCY",
      "evidence_citation": "DEV/docs/superpowers/specs/2026-08-19-step-3-execution-boundary-canonical-spec.md; exact closed enum member: ABORTED",
      "consumer_or_dependency": "owning catalog/schema/runtime contract; exact ID: ABORTED"
    },
    {
      "registry_family": "resolution_states",
      "id": "FAILED",
      "profile": "resolution_states",
      "scope_stratum": "ENGINE_ENUM_CONSISTENCY",
      "realization_state": "COMPLETE",
      "downstream_owner": null,
      "semantic_owner": "DEV/docs/superpowers/specs/2026-08-19-step-3-execution-boundary-canonical-spec.md",
      "admission_disposition": "ACTIVE_ADMITTED",
      "evidence_class": "ACCEPTED_ENUM_CONSISTENCY",
      "evidence_citation": "DEV/docs/superpowers/specs/2026-08-19-step-3-execution-boundary-canonical-spec.md; exact closed enum member: FAILED",
      "consumer_or_dependency": "owning catalog/schema/runtime contract; exact ID: FAILED"
    }
  ]
}
