{
  "registry_family": "context_discovery_channels",
  "registry_census": {
    "registry_family": "context_discovery_channels",
    "count": 7,
    "scope_stratum": "INHERITED_ROUND2",
    "admitted": 7,
    "embedded_nonowner": 0,
    "dormant_nonselectable": 0,
    "stale_remove": 0
  },
  "family_policy": {
    "scope_stratum": "INHERITED_ROUND2",
    "admission_disposition": "ACTIVE_ADMITTED",
    "admission_evidence": "ACCEPTED_OWNER_PLUS_CATALOG_CONSISTENCY",
    "semantic_owner": "DEV/docs/superpowers/specs/2026-08-24-r2-3-context-runtime-canonical-spec.md + DEV/docs/superpowers/specs/2026-08-24-r2-4-single-context-llm-execution-canonical-spec.md",
    "machine_destination_family": "DEV/CATALOG/core-catalog.json#/registries/context_discovery_channels",
    "consumer_or_dependency": "accepted Round-2 contract; machine realization remains with named R2.x/R2.7 owner",
    "identity_namespace_owner": "N/A Р Р†Р вЂљРІР‚Сњ closed engine vocabulary or non-package identity",
    "default_realization_state": "INHERITED_ACTIVE",
    "default_downstream_owner": "DEV/docs/superpowers/specs/2026-08-24-r2-3-context-runtime-canonical-spec.md + DEV/docs/superpowers/specs/2026-08-24-r2-4-single-context-llm-execution-canonical-spec.md",
    "notes": "Consistency checked; no S6D realization obligation unless a concrete contradiction or unsatisfied S6D consumer promotes the item."
  },
  "entries": [
    {
      "registry_family": "context_discovery_channels",
      "id": "context.current_scope",
      "profile": "context_discovery_channels",
      "scope_stratum": "INHERITED_ROUND2",
      "realization_state": "INHERITED_ACTIVE",
      "downstream_owner": "DEV/docs/superpowers/specs/2026-08-24-r2-3-context-runtime-canonical-spec.md + DEV/docs/superpowers/specs/2026-08-24-r2-4-single-context-llm-execution-canonical-spec.md",
      "semantic_owner": "DEV/docs/superpowers/specs/2026-08-24-r2-3-context-runtime-canonical-spec.md + DEV/docs/superpowers/specs/2026-08-24-r2-4-single-context-llm-execution-canonical-spec.md",
      "admission_disposition": "ACTIVE_ADMITTED",
      "evidence_class": "ACCEPTED_ENUM_CONSISTENCY",
      "evidence_citation": "DEV/docs/superpowers/specs/2026-08-24-r2-3-context-runtime-canonical-spec.md + DEV/docs/superpowers/specs/2026-08-24-r2-4-single-context-llm-execution-canonical-spec.md; exact closed enum member: context.current_scope",
      "consumer_or_dependency": "accepted Round-2 contract; machine realization remains with named R2.x/R2.7 owner; exact ID: context.current_scope"
    },
    {
      "registry_family": "context_discovery_channels",
      "id": "context.scene_manifest",
      "profile": "context_discovery_channels",
      "scope_stratum": "INHERITED_ROUND2",
      "realization_state": "INHERITED_ACTIVE",
      "downstream_owner": "DEV/docs/superpowers/specs/2026-08-24-r2-3-context-runtime-canonical-spec.md + DEV/docs/superpowers/specs/2026-08-24-r2-4-single-context-llm-execution-canonical-spec.md",
      "semantic_owner": "DEV/docs/superpowers/specs/2026-08-24-r2-3-context-runtime-canonical-spec.md + DEV/docs/superpowers/specs/2026-08-24-r2-4-single-context-llm-execution-canonical-spec.md",
      "admission_disposition": "ACTIVE_ADMITTED",
      "evidence_class": "ACCEPTED_ENUM_CONSISTENCY",
      "evidence_citation": "DEV/docs/superpowers/specs/2026-08-24-r2-3-context-runtime-canonical-spec.md + DEV/docs/superpowers/specs/2026-08-24-r2-4-single-context-llm-execution-canonical-spec.md; exact closed enum member: context.scene_manifest",
      "consumer_or_dependency": "accepted Round-2 contract; machine realization remains with named R2.x/R2.7 owner; exact ID: context.scene_manifest"
    },
    {
      "registry_family": "context_discovery_channels",
      "id": "context.explicit_ref",
      "profile": "context_discovery_channels",
      "scope_stratum": "INHERITED_ROUND2",
      "realization_state": "INHERITED_ACTIVE",
      "downstream_owner": "DEV/docs/superpowers/specs/2026-08-24-r2-3-context-runtime-canonical-spec.md + DEV/docs/superpowers/specs/2026-08-24-r2-4-single-context-llm-execution-canonical-spec.md",
      "semantic_owner": "DEV/docs/superpowers/specs/2026-08-24-r2-3-context-runtime-canonical-spec.md + DEV/docs/superpowers/specs/2026-08-24-r2-4-single-context-llm-execution-canonical-spec.md",
      "admission_disposition": "ACTIVE_ADMITTED",
      "evidence_class": "ACCEPTED_ENUM_CONSISTENCY",
      "evidence_citation": "DEV/docs/superpowers/specs/2026-08-24-r2-3-context-runtime-canonical-spec.md + DEV/docs/superpowers/specs/2026-08-24-r2-4-single-context-llm-execution-canonical-spec.md; exact closed enum member: context.explicit_ref",
      "consumer_or_dependency": "accepted Round-2 contract; machine realization remains with named R2.x/R2.7 owner; exact ID: context.explicit_ref"
    },
    {
      "registry_family": "context_discovery_channels",
      "id": "context.active_dependency",
      "profile": "context_discovery_channels",
      "scope_stratum": "INHERITED_ROUND2",
      "realization_state": "INHERITED_ACTIVE",
      "downstream_owner": "DEV/docs/superpowers/specs/2026-08-24-r2-3-context-runtime-canonical-spec.md + DEV/docs/superpowers/specs/2026-08-24-r2-4-single-context-llm-execution-canonical-spec.md",
      "semantic_owner": "DEV/docs/superpowers/specs/2026-08-24-r2-3-context-runtime-canonical-spec.md + DEV/docs/superpowers/specs/2026-08-24-r2-4-single-context-llm-execution-canonical-spec.md",
      "admission_disposition": "ACTIVE_ADMITTED",
      "evidence_class": "ACCEPTED_ENUM_CONSISTENCY",
      "evidence_citation": "DEV/docs/superpowers/specs/2026-08-24-r2-3-context-runtime-canonical-spec.md + DEV/docs/superpowers/specs/2026-08-24-r2-4-single-context-llm-execution-canonical-spec.md; exact closed enum member: context.active_dependency",
      "consumer_or_dependency": "accepted Round-2 contract; machine realization remains with named R2.x/R2.7 owner; exact ID: context.active_dependency"
    },
    {
      "registry_family": "context_discovery_channels",
      "id": "context.live_current",
      "profile": "context_discovery_channels",
      "scope_stratum": "INHERITED_ROUND2",
      "realization_state": "INHERITED_ACTIVE",
      "downstream_owner": "DEV/docs/superpowers/specs/2026-08-24-r2-3-context-runtime-canonical-spec.md + DEV/docs/superpowers/specs/2026-08-24-r2-4-single-context-llm-execution-canonical-spec.md",
      "semantic_owner": "DEV/docs/superpowers/specs/2026-08-24-r2-3-context-runtime-canonical-spec.md + DEV/docs/superpowers/specs/2026-08-24-r2-4-single-context-llm-execution-canonical-spec.md",
      "admission_disposition": "ACTIVE_ADMITTED",
      "evidence_class": "ACCEPTED_ENUM_CONSISTENCY",
      "evidence_citation": "DEV/docs/superpowers/specs/2026-08-24-r2-3-context-runtime-canonical-spec.md + DEV/docs/superpowers/specs/2026-08-24-r2-4-single-context-llm-execution-canonical-spec.md; exact closed enum member: context.live_current",
      "consumer_or_dependency": "accepted Round-2 contract; machine realization remains with named R2.x/R2.7 owner; exact ID: context.live_current"
    },
    {
      "registry_family": "context_discovery_channels",
      "id": "context.index_lookup",
      "profile": "context_discovery_channels",
      "scope_stratum": "INHERITED_ROUND2",
      "realization_state": "INHERITED_ACTIVE",
      "downstream_owner": "DEV/docs/superpowers/specs/2026-08-24-r2-3-context-runtime-canonical-spec.md + DEV/docs/superpowers/specs/2026-08-24-r2-4-single-context-llm-execution-canonical-spec.md",
      "semantic_owner": "DEV/docs/superpowers/specs/2026-08-24-r2-3-context-runtime-canonical-spec.md + DEV/docs/superpowers/specs/2026-08-24-r2-4-single-context-llm-execution-canonical-spec.md",
      "admission_disposition": "ACTIVE_ADMITTED",
      "evidence_class": "ACCEPTED_ENUM_CONSISTENCY",
      "evidence_citation": "DEV/docs/superpowers/specs/2026-08-24-r2-3-context-runtime-canonical-spec.md + DEV/docs/superpowers/specs/2026-08-24-r2-4-single-context-llm-execution-canonical-spec.md; exact closed enum member: context.index_lookup",
      "consumer_or_dependency": "accepted Round-2 contract; machine realization remains with named R2.x/R2.7 owner; exact ID: context.index_lookup"
    },
    {
      "registry_family": "context_discovery_channels",
      "id": "context.history_hint",
      "profile": "context_discovery_channels",
      "scope_stratum": "INHERITED_ROUND2",
      "realization_state": "INHERITED_ACTIVE",
      "downstream_owner": "DEV/docs/superpowers/specs/2026-08-24-r2-3-context-runtime-canonical-spec.md + DEV/docs/superpowers/specs/2026-08-24-r2-4-single-context-llm-execution-canonical-spec.md",
      "semantic_owner": "DEV/docs/superpowers/specs/2026-08-24-r2-3-context-runtime-canonical-spec.md + DEV/docs/superpowers/specs/2026-08-24-r2-4-single-context-llm-execution-canonical-spec.md",
      "admission_disposition": "ACTIVE_ADMITTED",
      "evidence_class": "ACCEPTED_ENUM_CONSISTENCY",
      "evidence_citation": "DEV/docs/superpowers/specs/2026-08-24-r2-3-context-runtime-canonical-spec.md + DEV/docs/superpowers/specs/2026-08-24-r2-4-single-context-llm-execution-canonical-spec.md; exact closed enum member: context.history_hint",
      "consumer_or_dependency": "accepted Round-2 contract; machine realization remains with named R2.x/R2.7 owner; exact ID: context.history_hint"
    }
  ]
}
