{
  "registry_family": "chronology_relation_kinds",
  "registry_census": {
    "registry_family": "chronology_relation_kinds",
    "count": 4,
    "scope_stratum": "INHERITED_ROUND2",
    "admitted": 4,
    "embedded_nonowner": 0,
    "dormant_nonselectable": 0,
    "stale_remove": 0
  },
  "family_policy": {
    "scope_stratum": "INHERITED_ROUND2",
    "admission_disposition": "ACTIVE_ADMITTED",
    "admission_evidence": "ACCEPTED_OWNER_PLUS_CATALOG_CONSISTENCY",
    "semantic_owner": "DEV/docs/superpowers/specs/2026-08-21-step-5-9-chronology-persistence-reconciliation-canonical-spec.md",
    "machine_destination_family": "DEV/CATALOG/core-catalog.json#/registries/chronology_relation_kinds",
    "consumer_or_dependency": "accepted Round-2 contract; machine realization remains with named R2.x/R2.7 owner",
    "identity_namespace_owner": "N/A Р Р†Р вЂљРІР‚Сњ closed engine vocabulary or non-package identity",
    "default_realization_state": "INHERITED_ACTIVE",
    "default_downstream_owner": "DEV/docs/superpowers/specs/2026-08-21-step-5-9-chronology-persistence-reconciliation-canonical-spec.md",
    "notes": "Consistency checked; no S6D realization obligation unless a concrete contradiction or unsatisfied S6D consumer promotes the item."
  },
  "entries": [
    {
      "registry_family": "chronology_relation_kinds",
      "id": "chronology.causes",
      "profile": "chronology_relation_kinds",
      "scope_stratum": "INHERITED_ROUND2",
      "realization_state": "INHERITED_ACTIVE",
      "downstream_owner": "DEV/docs/superpowers/specs/2026-08-21-step-5-9-chronology-persistence-reconciliation-canonical-spec.md",
      "semantic_owner": "DEV/docs/superpowers/specs/2026-08-21-step-5-9-chronology-persistence-reconciliation-canonical-spec.md",
      "admission_disposition": "ACTIVE_ADMITTED",
      "evidence_class": "ACCEPTED_ENUM_CONSISTENCY",
      "evidence_citation": "DEV/docs/superpowers/specs/2026-08-21-step-5-9-chronology-persistence-reconciliation-canonical-spec.md; exact closed enum member: chronology.causes",
      "consumer_or_dependency": "accepted Round-2 contract; machine realization remains with named R2.x/R2.7 owner; exact ID: chronology.causes"
    },
    {
      "registry_family": "chronology_relation_kinds",
      "id": "chronology.precedes",
      "profile": "chronology_relation_kinds",
      "scope_stratum": "INHERITED_ROUND2",
      "realization_state": "INHERITED_ACTIVE",
      "downstream_owner": "DEV/docs/superpowers/specs/2026-08-21-step-5-9-chronology-persistence-reconciliation-canonical-spec.md",
      "semantic_owner": "DEV/docs/superpowers/specs/2026-08-21-step-5-9-chronology-persistence-reconciliation-canonical-spec.md",
      "admission_disposition": "ACTIVE_ADMITTED",
      "evidence_class": "ACCEPTED_ENUM_CONSISTENCY",
      "evidence_citation": "DEV/docs/superpowers/specs/2026-08-21-step-5-9-chronology-persistence-reconciliation-canonical-spec.md; exact closed enum member: chronology.precedes",
      "consumer_or_dependency": "accepted Round-2 contract; machine realization remains with named R2.x/R2.7 owner; exact ID: chronology.precedes"
    },
    {
      "registry_family": "chronology_relation_kinds",
      "id": "chronology.same_coordinate",
      "profile": "chronology_relation_kinds",
      "scope_stratum": "INHERITED_ROUND2",
      "realization_state": "INHERITED_ACTIVE",
      "downstream_owner": "DEV/docs/superpowers/specs/2026-08-21-step-5-9-chronology-persistence-reconciliation-canonical-spec.md",
      "semantic_owner": "DEV/docs/superpowers/specs/2026-08-21-step-5-9-chronology-persistence-reconciliation-canonical-spec.md",
      "admission_disposition": "ACTIVE_ADMITTED",
      "evidence_class": "ACCEPTED_ENUM_CONSISTENCY",
      "evidence_citation": "DEV/docs/superpowers/specs/2026-08-21-step-5-9-chronology-persistence-reconciliation-canonical-spec.md; exact closed enum member: chronology.same_coordinate",
      "consumer_or_dependency": "accepted Round-2 contract; machine realization remains with named R2.x/R2.7 owner; exact ID: chronology.same_coordinate"
    },
    {
      "registry_family": "chronology_relation_kinds",
      "id": "chronology.elapsed",
      "profile": "chronology_relation_kinds",
      "scope_stratum": "INHERITED_ROUND2",
      "realization_state": "INHERITED_ACTIVE",
      "downstream_owner": "DEV/docs/superpowers/specs/2026-08-21-step-5-9-chronology-persistence-reconciliation-canonical-spec.md",
      "semantic_owner": "DEV/docs/superpowers/specs/2026-08-21-step-5-9-chronology-persistence-reconciliation-canonical-spec.md",
      "admission_disposition": "ACTIVE_ADMITTED",
      "evidence_class": "ACCEPTED_ENUM_CONSISTENCY",
      "evidence_citation": "DEV/docs/superpowers/specs/2026-08-21-step-5-9-chronology-persistence-reconciliation-canonical-spec.md; exact closed enum member: chronology.elapsed",
      "consumer_or_dependency": "accepted Round-2 contract; machine realization remains with named R2.x/R2.7 owner; exact ID: chronology.elapsed"
    }
  ]
}
