{
  "registry_family": "intent_execution_states",
  "registry_census": {
    "registry_family": "intent_execution_states",
    "count": 5,
    "scope_stratum": "ENGINE_ENUM_CONSISTENCY",
    "admitted": 5,
    "embedded_nonowner": 0,
    "dormant_nonselectable": 0,
    "stale_remove": 0
  },
  "family_policy": {
    "scope_stratum": "ENGINE_ENUM_CONSISTENCY",
    "admission_disposition": "ACTIVE_ADMITTED",
    "admission_evidence": "ACCEPTED_ENGINE_VOCABULARY_PLUS_CROSS_SURFACE_CONSISTENCY",
    "semantic_owner": "DEV/docs/superpowers/specs/2026-08-19-step-3-execution-boundary-canonical-spec.md",
    "machine_destination_family": "DEV/CATALOG/core-catalog.json#/registries/intent_execution_states",
    "consumer_or_dependency": "owning catalog/schema/runtime contract",
    "identity_namespace_owner": "N/A Р Р†Р вЂљРІР‚Сњ closed engine vocabulary or non-package identity",
    "default_realization_state": "COMPLETE",
    "default_downstream_owner": null,
    "notes": "Admission and registry-level realization are complete for S6D-02."
  },
  "entries": [
    {
      "registry_family": "intent_execution_states",
      "id": "intent.pending",
      "profile": "intent_execution_states",
      "scope_stratum": "ENGINE_ENUM_CONSISTENCY",
      "realization_state": "COMPLETE",
      "downstream_owner": null,
      "semantic_owner": "DEV/docs/superpowers/specs/2026-08-19-step-3-execution-boundary-canonical-spec.md",
      "admission_disposition": "ACTIVE_ADMITTED",
      "evidence_class": "ACCEPTED_ENUM_CONSISTENCY",
      "evidence_citation": "DEV/docs/superpowers/specs/2026-08-19-step-3-execution-boundary-canonical-spec.md; exact closed enum member: intent.pending",
      "consumer_or_dependency": "owning catalog/schema/runtime contract; exact ID: intent.pending"
    },
    {
      "registry_family": "intent_execution_states",
      "id": "intent.ready",
      "profile": "intent_execution_states",
      "scope_stratum": "ENGINE_ENUM_CONSISTENCY",
      "realization_state": "COMPLETE",
      "downstream_owner": null,
      "semantic_owner": "DEV/docs/superpowers/specs/2026-08-19-step-3-execution-boundary-canonical-spec.md",
      "admission_disposition": "ACTIVE_ADMITTED",
      "evidence_class": "ACCEPTED_ENUM_CONSISTENCY",
      "evidence_citation": "DEV/docs/superpowers/specs/2026-08-19-step-3-execution-boundary-canonical-spec.md; exact closed enum member: intent.ready",
      "consumer_or_dependency": "owning catalog/schema/runtime contract; exact ID: intent.ready"
    },
    {
      "registry_family": "intent_execution_states",
      "id": "intent.executed",
      "profile": "intent_execution_states",
      "scope_stratum": "ENGINE_ENUM_CONSISTENCY",
      "realization_state": "COMPLETE",
      "downstream_owner": null,
      "semantic_owner": "DEV/docs/superpowers/specs/2026-08-19-step-3-execution-boundary-canonical-spec.md",
      "admission_disposition": "ACTIVE_ADMITTED",
      "evidence_class": "ACCEPTED_ENUM_CONSISTENCY",
      "evidence_citation": "DEV/docs/superpowers/specs/2026-08-19-step-3-execution-boundary-canonical-spec.md; exact closed enum member: intent.executed",
      "consumer_or_dependency": "owning catalog/schema/runtime contract; exact ID: intent.executed"
    },
    {
      "registry_family": "intent_execution_states",
      "id": "intent.skipped_due_to_prior_result",
      "profile": "intent_execution_states",
      "scope_stratum": "ENGINE_ENUM_CONSISTENCY",
      "realization_state": "COMPLETE",
      "downstream_owner": null,
      "semantic_owner": "DEV/docs/superpowers/specs/2026-08-19-step-3-execution-boundary-canonical-spec.md",
      "admission_disposition": "ACTIVE_ADMITTED",
      "evidence_class": "ACCEPTED_ENUM_CONSISTENCY",
      "evidence_citation": "DEV/docs/superpowers/specs/2026-08-19-step-3-execution-boundary-canonical-spec.md; exact closed enum member: intent.skipped_due_to_prior_result",
      "consumer_or_dependency": "owning catalog/schema/runtime contract; exact ID: intent.skipped_due_to_prior_result"
    },
    {
      "registry_family": "intent_execution_states",
      "id": "intent.failed",
      "profile": "intent_execution_states",
      "scope_stratum": "ENGINE_ENUM_CONSISTENCY",
      "realization_state": "COMPLETE",
      "downstream_owner": null,
      "semantic_owner": "DEV/docs/superpowers/specs/2026-08-19-step-3-execution-boundary-canonical-spec.md",
      "admission_disposition": "ACTIVE_ADMITTED",
      "evidence_class": "ACCEPTED_ENUM_CONSISTENCY",
      "evidence_citation": "DEV/docs/superpowers/specs/2026-08-19-step-3-execution-boundary-canonical-spec.md; exact closed enum member: intent.failed",
      "consumer_or_dependency": "owning catalog/schema/runtime contract; exact ID: intent.failed"
    }
  ]
}
