{
  "registry_family": "truth_statuses",
  "registry_census": {
    "registry_family": "truth_statuses",
    "count": 3,
    "scope_stratum": "INHERITED_ROUND2",
    "admitted": 3,
    "embedded_nonowner": 0,
    "dormant_nonselectable": 0,
    "stale_remove": 0
  },
  "family_policy": {
    "scope_stratum": "INHERITED_ROUND2",
    "admission_disposition": "ACTIVE_ADMITTED",
    "admission_evidence": "ACCEPTED_OWNER_PLUS_CATALOG_CONSISTENCY",
    "semantic_owner": "DEV/ARCHITECTURE/CATALOG_INVENTORY.md + accepted Step-4/R2.3 information owners",
    "machine_destination_family": "DEV/CATALOG/core-catalog.json#/registries/truth_statuses",
    "consumer_or_dependency": "accepted Round-2 contract; machine realization remains with named R2.x/R2.7 owner",
    "identity_namespace_owner": "N/A Р Р†Р вЂљРІР‚Сњ closed engine vocabulary or non-package identity",
    "default_realization_state": "INHERITED_ACTIVE",
    "default_downstream_owner": "DEV/ARCHITECTURE/CATALOG_INVENTORY.md + accepted Step-4/R2.3 information owners",
    "notes": "Consistency checked; no S6D realization obligation unless a concrete contradiction or unsatisfied S6D consumer promotes the item."
  },
  "entries": [
    {
      "registry_family": "truth_statuses",
      "id": "truth.undetermined",
      "profile": "truth_statuses",
      "scope_stratum": "INHERITED_ROUND2",
      "realization_state": "INHERITED_ACTIVE",
      "downstream_owner": "DEV/ARCHITECTURE/CATALOG_INVENTORY.md + accepted Step-4/R2.3 information owners",
      "semantic_owner": "DEV/ARCHITECTURE/CATALOG_INVENTORY.md + accepted Step-4/R2.3 information owners",
      "admission_disposition": "ACTIVE_ADMITTED",
      "evidence_class": "ACCEPTED_ENUM_CONSISTENCY",
      "evidence_citation": "DEV/ARCHITECTURE/CATALOG_INVENTORY.md + accepted Step-4/R2.3 information owners; exact closed enum member: truth.undetermined",
      "consumer_or_dependency": "accepted Round-2 contract; machine realization remains with named R2.x/R2.7 owner; exact ID: truth.undetermined"
    },
    {
      "registry_family": "truth_statuses",
      "id": "truth.established",
      "profile": "truth_statuses",
      "scope_stratum": "INHERITED_ROUND2",
      "realization_state": "INHERITED_ACTIVE",
      "downstream_owner": "DEV/ARCHITECTURE/CATALOG_INVENTORY.md + accepted Step-4/R2.3 information owners",
      "semantic_owner": "DEV/ARCHITECTURE/CATALOG_INVENTORY.md + accepted Step-4/R2.3 information owners",
      "admission_disposition": "ACTIVE_ADMITTED",
      "evidence_class": "ACCEPTED_ENUM_CONSISTENCY",
      "evidence_citation": "DEV/ARCHITECTURE/CATALOG_INVENTORY.md + accepted Step-4/R2.3 information owners; exact closed enum member: truth.established",
      "consumer_or_dependency": "accepted Round-2 contract; machine realization remains with named R2.x/R2.7 owner; exact ID: truth.established"
    },
    {
      "registry_family": "truth_statuses",
      "id": "truth.disproven",
      "profile": "truth_statuses",
      "scope_stratum": "INHERITED_ROUND2",
      "realization_state": "INHERITED_ACTIVE",
      "downstream_owner": "DEV/ARCHITECTURE/CATALOG_INVENTORY.md + accepted Step-4/R2.3 information owners",
      "semantic_owner": "DEV/ARCHITECTURE/CATALOG_INVENTORY.md + accepted Step-4/R2.3 information owners",
      "admission_disposition": "ACTIVE_ADMITTED",
      "evidence_class": "ACCEPTED_ENUM_CONSISTENCY",
      "evidence_citation": "DEV/ARCHITECTURE/CATALOG_INVENTORY.md + accepted Step-4/R2.3 information owners; exact closed enum member: truth.disproven",
      "consumer_or_dependency": "accepted Round-2 contract; machine realization remains with named R2.x/R2.7 owner; exact ID: truth.disproven"
    }
  ]
}
