{
  "registry_family": "life_state_policies",
  "registry_census": {
    "registry_family": "life_state_policies",
    "count": 2,
    "scope_stratum": "ENGINE_ENUM_CONSISTENCY",
    "admitted": 2,
    "embedded_nonowner": 0,
    "dormant_nonselectable": 0,
    "stale_remove": 0
  },
  "family_policy": {
    "scope_stratum": "ENGINE_ENUM_CONSISTENCY",
    "admission_disposition": "ACTIVE_ADMITTED",
    "admission_evidence": "ACCEPTED_ENGINE_VOCABULARY_PLUS_CROSS_SURFACE_CONSISTENCY",
    "semantic_owner": "DEV/ARCHITECTURE/CATALOG_INVENTORY.md",
    "machine_destination_family": "DEV/CATALOG/core-catalog.json#/registries/life_state_policies",
    "consumer_or_dependency": "owning catalog/schema/runtime contract",
    "identity_namespace_owner": "N/A Р Р†Р вЂљРІР‚Сњ closed engine vocabulary or non-package identity",
    "default_realization_state": "COMPLETE",
    "default_downstream_owner": null,
    "notes": "Admission and registry-level realization are complete for S6D-02."
  },
  "entries": [
    {
      "registry_family": "life_state_policies",
      "id": "life_policy.dnd2024.character_like",
      "profile": "life_state_policies",
      "scope_stratum": "ENGINE_ENUM_CONSISTENCY",
      "realization_state": "COMPLETE",
      "downstream_owner": null,
      "semantic_owner": "DEV/ARCHITECTURE/CATALOG_INVENTORY.md",
      "admission_disposition": "ACTIVE_ADMITTED",
      "evidence_class": "ACCEPTED_ENUM_CONSISTENCY",
      "evidence_citation": "DEV/ARCHITECTURE/CATALOG_INVENTORY.md; exact closed enum member: life_policy.dnd2024.character_like",
      "consumer_or_dependency": "owning catalog/schema/runtime contract; exact ID: life_policy.dnd2024.character_like"
    },
    {
      "registry_family": "life_state_policies",
      "id": "life_policy.dnd2024.monster_default",
      "profile": "life_state_policies",
      "scope_stratum": "ENGINE_ENUM_CONSISTENCY",
      "realization_state": "COMPLETE",
      "downstream_owner": null,
      "semantic_owner": "DEV/ARCHITECTURE/CATALOG_INVENTORY.md",
      "admission_disposition": "ACTIVE_ADMITTED",
      "evidence_class": "ACCEPTED_ENUM_CONSISTENCY",
      "evidence_citation": "DEV/ARCHITECTURE/CATALOG_INVENTORY.md; exact closed enum member: life_policy.dnd2024.monster_default",
      "consumer_or_dependency": "owning catalog/schema/runtime contract; exact ID: life_policy.dnd2024.monster_default"
    }
  ]
}
