{
  "registry_family": "range_modes",
  "registry_census": {
    "registry_family": "range_modes",
    "count": 8,
    "scope_stratum": "ENGINE_ENUM_CONSISTENCY",
    "admitted": 8,
    "embedded_nonowner": 0,
    "dormant_nonselectable": 0,
    "stale_remove": 0
  },
  "family_policy": {
    "scope_stratum": "ENGINE_ENUM_CONSISTENCY",
    "admission_disposition": "ACTIVE_ADMITTED",
    "admission_evidence": "ACCEPTED_ENGINE_VOCABULARY_PLUS_CROSS_SURFACE_CONSISTENCY",
    "semantic_owner": "DEV/ARCHITECTURE/CATALOG_INVENTORY.md",
    "machine_destination_family": "DEV/CATALOG/core-catalog.json#/registries/range_modes",
    "consumer_or_dependency": "owning catalog/schema/runtime contract",
    "identity_namespace_owner": "N/A Р Р†Р вЂљРІР‚Сњ closed engine vocabulary or non-package identity",
    "default_realization_state": "COMPLETE",
    "default_downstream_owner": null,
    "notes": "Admission and registry-level realization are complete for S6D-02."
  },
  "entries": [
    {
      "registry_family": "range_modes",
      "id": "range.self",
      "profile": "range_modes",
      "scope_stratum": "ENGINE_ENUM_CONSISTENCY",
      "realization_state": "COMPLETE",
      "downstream_owner": null,
      "semantic_owner": "DEV/ARCHITECTURE/CATALOG_INVENTORY.md",
      "admission_disposition": "ACTIVE_ADMITTED",
      "evidence_class": "ACCEPTED_ENUM_CONSISTENCY",
      "evidence_citation": "DEV/ARCHITECTURE/CATALOG_INVENTORY.md; exact closed enum member: range.self",
      "consumer_or_dependency": "owning catalog/schema/runtime contract; exact ID: range.self"
    },
    {
      "registry_family": "range_modes",
      "id": "range.touch",
      "profile": "range_modes",
      "scope_stratum": "ENGINE_ENUM_CONSISTENCY",
      "realization_state": "COMPLETE",
      "downstream_owner": null,
      "semantic_owner": "DEV/ARCHITECTURE/CATALOG_INVENTORY.md",
      "admission_disposition": "ACTIVE_ADMITTED",
      "evidence_class": "ACCEPTED_ENUM_CONSISTENCY",
      "evidence_citation": "DEV/ARCHITECTURE/CATALOG_INVENTORY.md; exact closed enum member: range.touch",
      "consumer_or_dependency": "owning catalog/schema/runtime contract; exact ID: range.touch"
    },
    {
      "registry_family": "range_modes",
      "id": "range.distance",
      "profile": "range_modes",
      "scope_stratum": "ENGINE_ENUM_CONSISTENCY",
      "realization_state": "COMPLETE",
      "downstream_owner": null,
      "semantic_owner": "DEV/ARCHITECTURE/CATALOG_INVENTORY.md",
      "admission_disposition": "ACTIVE_ADMITTED",
      "evidence_class": "ACCEPTED_ENUM_CONSISTENCY",
      "evidence_citation": "DEV/ARCHITECTURE/CATALOG_INVENTORY.md; exact closed enum member: range.distance",
      "consumer_or_dependency": "owning catalog/schema/runtime contract; exact ID: range.distance"
    },
    {
      "registry_family": "range_modes",
      "id": "range.sight",
      "profile": "range_modes",
      "scope_stratum": "ENGINE_ENUM_CONSISTENCY",
      "realization_state": "COMPLETE",
      "downstream_owner": null,
      "semantic_owner": "DEV/ARCHITECTURE/CATALOG_INVENTORY.md",
      "admission_disposition": "ACTIVE_ADMITTED",
      "evidence_class": "ACCEPTED_ENUM_CONSISTENCY",
      "evidence_citation": "DEV/ARCHITECTURE/CATALOG_INVENTORY.md; exact closed enum member: range.sight",
      "consumer_or_dependency": "owning catalog/schema/runtime contract; exact ID: range.sight"
    },
    {
      "registry_family": "range_modes",
      "id": "range.unlimited",
      "profile": "range_modes",
      "scope_stratum": "ENGINE_ENUM_CONSISTENCY",
      "realization_state": "COMPLETE",
      "downstream_owner": null,
      "semantic_owner": "DEV/ARCHITECTURE/CATALOG_INVENTORY.md",
      "admission_disposition": "ACTIVE_ADMITTED",
      "evidence_class": "ACCEPTED_ENUM_CONSISTENCY",
      "evidence_citation": "DEV/ARCHITECTURE/CATALOG_INVENTORY.md; exact closed enum member: range.unlimited",
      "consumer_or_dependency": "owning catalog/schema/runtime contract; exact ID: range.unlimited"
    },
    {
      "registry_family": "range_modes",
      "id": "range.same_location",
      "profile": "range_modes",
      "scope_stratum": "ENGINE_ENUM_CONSISTENCY",
      "realization_state": "COMPLETE",
      "downstream_owner": null,
      "semantic_owner": "DEV/ARCHITECTURE/CATALOG_INVENTORY.md",
      "admission_disposition": "ACTIVE_ADMITTED",
      "evidence_class": "ACCEPTED_ENUM_CONSISTENCY",
      "evidence_citation": "DEV/ARCHITECTURE/CATALOG_INVENTORY.md; exact closed enum member: range.same_location",
      "consumer_or_dependency": "owning catalog/schema/runtime contract; exact ID: range.same_location"
    },
    {
      "registry_family": "range_modes",
      "id": "range.near",
      "profile": "range_modes",
      "scope_stratum": "ENGINE_ENUM_CONSISTENCY",
      "realization_state": "COMPLETE",
      "downstream_owner": null,
      "semantic_owner": "DEV/ARCHITECTURE/CATALOG_INVENTORY.md",
      "admission_disposition": "ACTIVE_ADMITTED",
      "evidence_class": "ACCEPTED_ENUM_CONSISTENCY",
      "evidence_citation": "DEV/ARCHITECTURE/CATALOG_INVENTORY.md; exact closed enum member: range.near",
      "consumer_or_dependency": "owning catalog/schema/runtime contract; exact ID: range.near"
    },
    {
      "registry_family": "range_modes",
      "id": "range.reachable",
      "profile": "range_modes",
      "scope_stratum": "ENGINE_ENUM_CONSISTENCY",
      "realization_state": "COMPLETE",
      "downstream_owner": null,
      "semantic_owner": "DEV/ARCHITECTURE/CATALOG_INVENTORY.md",
      "admission_disposition": "ACTIVE_ADMITTED",
      "evidence_class": "ACCEPTED_ENUM_CONSISTENCY",
      "evidence_citation": "DEV/ARCHITECTURE/CATALOG_INVENTORY.md; exact closed enum member: range.reachable",
      "consumer_or_dependency": "owning catalog/schema/runtime contract; exact ID: range.reachable"
    }
  ]
}
