{
  "registry_family": "durability_obligation_kinds",
  "registry_census": {
    "registry_family": "durability_obligation_kinds",
    "count": 2,
    "scope_stratum": "INHERITED_ROUND2",
    "admitted": 2,
    "embedded_nonowner": 0,
    "dormant_nonselectable": 0,
    "stale_remove": 0
  },
  "family_policy": {
    "scope_stratum": "INHERITED_ROUND2",
    "admission_disposition": "ACTIVE_ADMITTED",
    "admission_evidence": "ACCEPTED_OWNER_PLUS_CATALOG_CONSISTENCY",
    "semantic_owner": "DEV/docs/superpowers/specs/2026-08-20-step-5-5-soft-hard-save-durability-canonical-spec.md + DEV/docs/superpowers/specs/2026-08-20-step-5-6-campaign-publication-crash-consistency-canonical-spec.md",
    "machine_destination_family": "DEV/CATALOG/core-catalog.json#/registries/durability_obligation_kinds",
    "consumer_or_dependency": "accepted Round-2 contract; machine realization remains with named R2.x/R2.7 owner",
    "identity_namespace_owner": "N/A Р Р†Р вЂљРІР‚Сњ closed engine vocabulary or non-package identity",
    "default_realization_state": "INHERITED_ACTIVE",
    "default_downstream_owner": "DEV/docs/superpowers/specs/2026-08-20-step-5-5-soft-hard-save-durability-canonical-spec.md + DEV/docs/superpowers/specs/2026-08-20-step-5-6-campaign-publication-crash-consistency-canonical-spec.md",
    "notes": "Consistency checked; no S6D realization obligation unless a concrete contradiction or unsatisfied S6D consumer promotes the item."
  },
  "entries": [
    {
      "registry_family": "durability_obligation_kinds",
      "id": "durability.may_defer",
      "profile": "durability_obligation_kinds",
      "scope_stratum": "INHERITED_ROUND2",
      "realization_state": "INHERITED_ACTIVE",
      "downstream_owner": "DEV/docs/superpowers/specs/2026-08-20-step-5-5-soft-hard-save-durability-canonical-spec.md + DEV/docs/superpowers/specs/2026-08-20-step-5-6-campaign-publication-crash-consistency-canonical-spec.md",
      "semantic_owner": "DEV/docs/superpowers/specs/2026-08-20-step-5-5-soft-hard-save-durability-canonical-spec.md + DEV/docs/superpowers/specs/2026-08-20-step-5-6-campaign-publication-crash-consistency-canonical-spec.md",
      "admission_disposition": "ACTIVE_ADMITTED",
      "evidence_class": "ACCEPTED_ENUM_CONSISTENCY",
      "evidence_citation": "DEV/docs/superpowers/specs/2026-08-20-step-5-5-soft-hard-save-durability-canonical-spec.md + DEV/docs/superpowers/specs/2026-08-20-step-5-6-campaign-publication-crash-consistency-canonical-spec.md; exact closed enum member: durability.may_defer",
      "consumer_or_dependency": "accepted Round-2 contract; machine realization remains with named R2.x/R2.7 owner; exact ID: durability.may_defer"
    },
    {
      "registry_family": "durability_obligation_kinds",
      "id": "durability.must_be_durable_before",
      "profile": "durability_obligation_kinds",
      "scope_stratum": "INHERITED_ROUND2",
      "realization_state": "INHERITED_ACTIVE",
      "downstream_owner": "DEV/docs/superpowers/specs/2026-08-20-step-5-5-soft-hard-save-durability-canonical-spec.md + DEV/docs/superpowers/specs/2026-08-20-step-5-6-campaign-publication-crash-consistency-canonical-spec.md",
      "semantic_owner": "DEV/docs/superpowers/specs/2026-08-20-step-5-5-soft-hard-save-durability-canonical-spec.md + DEV/docs/superpowers/specs/2026-08-20-step-5-6-campaign-publication-crash-consistency-canonical-spec.md",
      "admission_disposition": "ACTIVE_ADMITTED",
      "evidence_class": "ACCEPTED_ENUM_CONSISTENCY",
      "evidence_citation": "DEV/docs/superpowers/specs/2026-08-20-step-5-5-soft-hard-save-durability-canonical-spec.md + DEV/docs/superpowers/specs/2026-08-20-step-5-6-campaign-publication-crash-consistency-canonical-spec.md; exact closed enum member: durability.must_be_durable_before",
      "consumer_or_dependency": "accepted Round-2 contract; machine realization remains with named R2.x/R2.7 owner; exact ID: durability.must_be_durable_before"
    }
  ]
}
